{
	"format": "pi-research-adapter-package",
	"manifestVersion": 1,
	"contractVersion": 1,
	"packageId": "example-repro-runtime",
	"packageVersion": "1.0.0",
	"adapterId": "example-repro-runtime",
	"adapterVersion": "1.0.0",
	"adapterKind": "analysis_runtime",
	"entrypoint": "entry.mjs",
	"capabilities": [
		{
			"capability": "execute",
			"required": true,
			"constraints": { "fixture": true }
		}
	],
	"requiredBrokers": [],
	"isolationProfiles": ["jsonl_process", "strong_isolation"],
	"licenseExpression": "Apache-2.0",
	"provenance": {
		"source": "pi-research-agent public example",
		"repositoryUrl": "https://github.com/Hilbert-beinghappy/research-agent"
	},
	"packageHash": {
		"algorithm": "sha256",
		"value": "f376abb9f28210a0749e3ac88bb3d0eb84bb1e390d4fbe7aff89dec8e7dff60e"
	},
	"sbomPath": "SBOM.spdx.json",
	"sbomHash": {
		"algorithm": "sha256",
		"value": "e05980b8abdb3d45b475d7c5c6347ab73ce149dfbee008a2087e9b4841e74544"
	}
}
