{
	"format": "pi-research-adapter-package",
	"manifestVersion": 1,
	"contractVersion": 1,
	"packageId": "example-json-artifact",
	"packageVersion": "1.0.0",
	"adapterId": "example-json-artifact",
	"adapterVersion": "1.0.0",
	"adapterKind": "artifact",
	"entrypoint": "entry.mjs",
	"capabilities": [
		{
			"capability": "render",
			"required": true,
			"constraints": { "fixture": true }
		}
	],
	"requiredBrokers": [],
	"isolationProfiles": ["jsonl_process", "strong_isolation"],
	"licenseExpression": "Apache-2.0",
	"provenance": {
		"source": "pi-research-agent public example",
		"repositoryUrl": "https://github.com/Hilbert-beinghappy/research-agent"
	},
	"packageHash": {
		"algorithm": "sha256",
		"value": "3ff4f4a91bbbce989fd4b42c367878d6abd611c2a5158dee2db176147f899f8e"
	},
	"sbomPath": "SBOM.spdx.json",
	"sbomHash": {
		"algorithm": "sha256",
		"value": "5968d877fe5739a7763f7fd37a223d02056c51388a49357066791f734aec8907"
	}
}
